{"broken_relationship_status":"failed","chain_id":"control-to-worker","channel_contracts":[{"channel_id":"control.commands","sha256":"f5dc44590c8e9697a00865dc74b721f3088335522e584f8ae96355dc2b5a4216"}],"missing_evidence_status":"incomplete","require_connected_trace_graph":true,"required_domain_ids":["control","worker"],"schema_version":"causal-chain.v1"}
